FIELD,TYPE,DESCRIPTIONTAX_DESCRIPTION,text,A general description of the taxTAX_TYPE,text,"Type of tax (ie Sales, Income)"TAX_JURISDICTION,text,"Level of government responsible for tax (ie Federal, Provincial)"TAX_CALCULATION,text,A description of how the tax is calculated (ie rate)TAX_RATE,text,"The rate at which the tax is applied, if charged as a rate"TAX_YEAR,text,Year to which the tax information is currentURL,text,A url that provides more detailed information regarding the taxNOTES,text,Further notes and caveats regarding the tax information presented